{
  "$schema": "http://json-schema.org/draft-07/schema#",
  "title": "Mobius Agent Manifest",
  "type": "object",
  "required": ["name", "version", "roles", "providers", "entrypoint"],
  "properties": {
    "name": { "type": "string", "pattern": "^[a-z0-9-]{2,64}$" },
    "version": { "type": "string" },
    "roles": { "type": "array", "items": { "type": "string" } },
    "providers": { "type": "array", "items": { "type": "string" } },
    "entrypoint": { "type": "string" },
    "capabilities": { "type": "array", "items": { "type": "string" } },
    "policies": { "type": "array", "items": { "type": "string" } },
    "constraints": { "type": "object" },
    "telemetry": { "type": "object" }
  }
}
